{
  "schemaVersion": "1.0",
  "kind": "loopengineer.handoffManifest",
  "manifest_id": "handoff-8-context-rotation",
  "created_at": "2026-06-15T09:30:00Z",
  "rotation_reason": "context_risk",
  "state_root": {
    "path": ".loopengineer/state/current/",
    "description": "Directory containing the current machine-readable loop state and report locators."
  },
  "authority": {
    "allowed_sources": [
      "state_root",
      "handoff_manifest",
      "live_facts",
      "git",
      "github",
      "artifacts"
    ],
    "forbidden_sources": [
      "retired_thread_history",
      "old_thread_transcript",
      "memory_only_claim",
      "inline_large_artifact"
    ]
  },
  "work_scope": {
    "goal": "Continue issue #8 handoff rotation protocol work from explicit state and locators.",
    "in_scope": [
      "Read the handoff manifest.",
      "Verify git and GitHub facts before continuing.",
      "Consume referenced artifacts by locator."
    ],
    "out_of_scope": [
      "Treat old thread text as authoritative.",
      "Create a full recovery runtime."
    ]
  },
  "current_state": {
    "branch": "work/8-handoff-rotation",
    "head_sha": "1234567890abcdef1234567890abcdef12345678",
    "workspace": "/Users/mc/dev/LoopEngineer.worktrees/8-handoff-rotation",
    "status": "ready_for_handoff"
  },
  "evidence": [
    {
      "id": "issue-8",
      "kind": "github",
      "locator": "https://github.com/MC-and-his-Agents/LoopEngineer/issues/8",
      "consumed": true
    },
    {
      "id": "state-digest",
      "kind": "artifact",
      "locator": ".loopengineer/state/current/digest.json",
      "consumed": false
    }
  ],
  "handoff_checklist": [
    {
      "item": "State root locator is present.",
      "status": "done",
      "locator": ".loopengineer/state/current/"
    },
    {
      "item": "Next owner and next action are explicit.",
      "status": "done"
    },
    {
      "item": "Old thread history is excluded from authority.",
      "status": "done"
    }
  ],
  "next_owner": "replacement_thread",
  "next_action": "Verify current git and GitHub facts, then continue only from the manifest and referenced state root.",
  "prohibitions": [
    "do_not_use_retired_thread_as_fact_source",
    "do_not_inline_large_artifacts",
    "do_not_create_replacement_thread_without_user_or_runtime_action",
    "do_not_implement_recovery_runtime_from_manifest"
  ]
}
